{
    "id": "f47ac10b-58cc-4372-a567-0e02b2c3d484",
    "email": "guest@hospeda.com",
    "username": "guest_user",
    "firstName": "Usuario",
    "lastName": "Invitado",
    "avatar": "https://images.unsplash.com/photo-1511367461989-f85a21fda167?w=150&h=150&fit=crop&crop=face",
    "bio": "Usuario invitado para navegación pública del sitio web. Acceso limitado a funcionalidades básicas de consulta y visualización de contenido.",
    "role": "GUEST",
    "isVerified": false,
    "contactInfo": {
        "personalEmail": "guest@hospeda.com",
        "preferredEmail": "PERSONAL",
        "preferredPhone": "MOBILE"
    },
    "socialNetworks": {},
    "location": {
        "state": "Entre Ríos",
        "city": "Paraná",
        "country": "Argentina",
        "zipCode": "3100",
        "coordinates": {
            "lat": "-31.7333",
            "lng": "-60.5333"
        }
    },
    "preferences": {
        "language": "es",
        "currency": "ARS",
        "notifications": {
            "email": false,
            "push": false,
            "marketing": false
        }
    },
    "adminInfo": {
        "notes": "Usuario invitado para acceso público",
        "favorite": false
    }
}
