{
    "id": "f47ac10b-58cc-4372-a567-0e02b2c3d479",
    "email": "superadmin@hospeda.com",
    "username": "superadmin",
    "firstName": "Super",
    "lastName": "Administrator",
    "avatar": "https://images.unsplash.com/photo-1472099645785-5658abf4ff4e?w=150&h=150&fit=crop&crop=face",
    "bio": "Super administrador del sistema con acceso completo a todas las funcionalidades. Responsable de la gestión general de la plataforma y configuraciones del sistema.",
    "role": "SUPER_ADMIN",
    "isVerified": true,
    "contactInfo": {
        "personalEmail": "superadmin@hospeda.com",
        "workEmail": "admin@hospeda.com",
        "mobilePhone": "+54 11 5555-0001",
        "preferredEmail": "WORK",
        "preferredPhone": "MOBILE"
    },
    "socialNetworks": {
        "linkedin": "https://linkedin.com/in/superadmin-hospeda"
    },
    "location": {
        "state": "Entre Ríos",
        "city": "Paraná",
        "country": "Argentina",
        "zipCode": "3100",
        "coordinates": {
            "lat": "-31.7333",
            "lng": "-60.5333"
        }
    },
    "preferences": {
        "language": "es",
        "currency": "ARS",
        "notifications": {
            "email": true,
            "push": true,
            "marketing": false
        }
    },
    "adminInfo": {
        "notes": "Super administrador principal del sistema",
        "favorite": false
    }
}
